{
  "contract_version": "v1",
  "run_id": "run_20260323_001",
  "story_id": "story_demo_001",
  "acceptance_criteria": [
    "Register User",
    "Login User with correct email and password",
    "Add Products in Cart"
  ],
  "target_url": "http://localhost:3000",
  "model": {
    "provider": "openai",
    "name": "gpt-4.1",
    "temperature": 0.15
  },
  "execution_context": {
    "base_url": "http://localhost:3000",
    "environment_type": "local",
    "auth": {
      "mode": "none"
    },
    "browser": {
      "headless": false,
      "slow_mo_ms": 1200,
      "navigation_timeout_ms": 45000,
      "viewport": {
        "width": 1366,
        "height": 768
      }
    },
    "safety": {
      "domain_allowlist": ["localhost", "127.0.0.1"],
      "max_pages": 25,
      "max_depth": 3,
      "crawl_timeout_ms": 60000
    }
  },
  "metadata": {
    "requested_by": "poc-user",
    "requested_at": "2026-03-23T10:00:00Z"
  }
}
